{
  "documentId": "spec-implementation-abstraction",
  "documentType": "Knowledge",
  "schemaRef": "KnowledgeSchema/v6",
  "status": "DRAFT",
  "content": {
    "title": {
      "blockType": "Title",
      "title": "仕様と実装の抽象と具体、その境界の引き方を扱う概念：spec-implementation-abstraction"
    },
    "description": {
      "blockType": "Overview",
      "title": "概要",
      "questions": [
        "仕様はどこまで抽象化してよいか",
        "抽象化しすぎたかどうかを、どう見分けるか",
        "仕様が持つ特徴と、規約が持つ特徴をどう分けるか",
        "仕様に書いたのに、その内容が実装に現れないのはなぜか",
        "抽象の段はどこからどこまでか。その際限は誰が決めるか"
      ],
      "text": "仕様をどこまで抽象化してよいかを定める概念。抽象化は情報を削減することではなく、意味を保った特徴へ分解して共通概念で束ねることである。抽象化してよい限度は、具体を断定できる特徴が残っているかで決まる。"
    },
    "nodes": {
      "blockType": "Nodes",
      "title": "仕様と実装の抽象と具体",
      "items": [
        {
          "name": "抽象化してよい限度",
          "kind": "定義",
          "summary": "抽象は、一段下ろしたときに元の具体へ戻る高さまでしか上げてはいけない。上げすぎると別の具体が混ざり、そこから元のものを取り出せなくなる。犬を動物まで上げると、一段下ろしても犬になるとは限らず猫にもなる。耳がある・四足歩行・鼻が利く・しっぽがある、という特徴の束まで下げて初めて、一段下が犬に定まる。",
          "children": [
            {
              "name": "一段とは何か",
              "kind": "定義",
              "summary": "高さは具体からの距離で測る。一段とは、そこから具体が一意に定まる距離を指す。「高い・低い」で測るのではなく、一意に落ちるかどうかで測る。犬の特徴の束は犬のちょうど一段上にあり、動物は二段以上離れているので一段下ろしても犬に定まらない。"
            },
            {
              "name": "際限は自分たちで決める",
              "kind": "補足",
              "summary": "抽象と具体には段があり、上にも下にも際限はない。したがって際限は自分たちで決める必要がある。決め方は「一段下ろしたときに具体が一意に定まる高さ」である。"
            },
            {
              "name": "正しい高さは、何が成り立つかで書く",
              "kind": "判断基準",
              "summary": "正しい高さを、どう作るかで書いてはいけない。「値を書き込む処理と検証する処理を分ける」は作り方である。「検証だけを求めたとき、書き込みは起きない」が、成り立つことである。犬の特徴が「鼻が利く」であって「嗅覚器官の構造」ではないのと同じで、特徴は意味であって仕組みではない。"
            }
          ]
        },
        {
          "name": "抽象とは何か",
          "kind": "定義",
          "summary": "抽象は簡略化ではないし、情報の削減でもない。特徴を抽出して共通概念として表現することが抽象である。意味を保った特徴へ分解するのであって、次元は落ちても断定に要る情報は落とさない。",
          "children": [
            {
              "name": "次元圧縮としての抽象化",
              "kind": "補足",
              "summary": "具体を断定できる特徴が残っているなら、そこまでは分解して次元を落としてよい。落としてよい限度は、落とした後も具体を区別できるかで決まる。ただし機械の次元圧縮と違い、ここで作る特徴は人が読める意味を持たねばならない。軸を合成せず、意味を保った特徴を選ぶ。"
            },
            {
              "name": "要望から特徴を見出す",
              "kind": "補足",
              "summary": "要望は抽象的なこともあれば具体的なこともある。どちらであっても、その要望から具体を断定できる特徴を抽出する工程が必ず入る。抽出する特徴の数が適切でなければ、後段は誤った具体へ落ちる。"
            }
          ]
        },
        {
          "name": "抽象の段",
          "kind": "分類",
          "summary": "段は1本のピラミッドではない。事業の側とモデルの側の2系統があり、両者は包含ではなく対応の関係にある。",
          "children": [
            {
              "name": "事業の側",
              "kind": "定義",
              "summary": "事業領域から業務領域（サブドメイン）へ。事業活動の分け方であり、抽象の段の上限にあたる。事業領域は複数の業務領域から構成され、会社と1対1で対応するとは限らず、時とともに移り変わる。業務領域の境界は、強く関連するユースケースの集まりとして決まる。同じアクター・同じ外部システムとつながり、密接に関係するデータを操作するユースケース群が、ひとつの業務領域を形成する。"
            },
            {
              "name": "モデルの側",
              "kind": "定義",
              "summary": "区切られた文脈から、ドメインモデルの部品（値オブジェクト・エンティティ・集約・業務サービス）と業務ユースケースへ、そして実装へ。ピラミッドになるのは、区切られた文脈から下である。これらはすべて ドメイン駆動設計 が与える抽象概念であり、Waffle が足したものではない。"
            },
            {
              "name": "2つの分割は目的が違う",
              "kind": "対比",
              "summary": "業務領域の分割と、区切られた文脈の分割は目的が異なる。したがって業務領域の下に区切られた文脈がぶら下がるのではなく、両者は対応するだけである。"
            },
            {
              "name": "Waffle 独自の点はどこか",
              "kind": "対比",
              "summary": "ドメイン駆動設計は、実装を伴う抽象概念——値オブジェクト・エンティティ・集約・業務サービス・業務ユースケース——を与える。Waffle が定めるのは、書き手がそれらを仕様として書くとき、具体へ意味的整合を保ったまま落とせる高さまで抽象化する、という限度である。要素を足したのではなく、既にある要素をどの高さで書くかを定めた点が独自である。",
              "children": [
                {
                  "name": "抽象化の対象は要素ではなく記述",
                  "kind": "補足",
                  "summary": "要素そのものの位置は ドメイン駆動設計 が決めており、動かせない。動かせるのは、その要素について仕様が何をどう書くかである。同じ集約を「Document は正しい状態を保つ」とも「いかなる操作列のあとでも、確定した Document は宣言された構造を満たす」とも書ける。要素は同じで、記述の高さが違う。"
                },
                {
                  "name": "実装を伴わない要素は対象外",
                  "kind": "判断基準",
                  "summary": "事業領域・業務領域・区切られた文脈は、この規則の対象ではない。投資判断の道具であり、言葉が通用する範囲であって、そこから直接コードが落ちるわけではないためである。"
                },
                {
                  "name": "意味的整合と構造的整合の分担",
                  "kind": "対比",
                  "summary": "意味的整合（振る舞いが仕様どおりであること）は、受け入れ基準とシナリオの転写と照合で担保する。構造的整合（在るべきものが在るべき形で在ること）は、規約の宣言と実物の突き合わせで担保する。高さを定めるのは前者のためであり、後者は規約が担う。"
                }
              ]
            },
            {
              "name": "規約は段ではない",
              "kind": "対比",
              "summary": "言語やアーキテクチャという構造そのものは、段として積まれるのではなく規約が繋ぐ。規約は仕様の上にも下にも位置せず、実装を導くもう一つの入力として横から入る。"
            }
          ]
        },
        {
          "name": "上げすぎと、潰しは同じ失敗",
          "kind": "対比",
          "summary": "抽象化の失敗は2つの見え方をするが、同じことが起きている。どちらも一段下ろして元の具体へ戻らない。",
          "children": [
            {
              "name": "上げすぎ",
              "kind": "実例",
              "summary": "犬を動物まで上げる。一段下ろすと猫にもなり、別の具体が混ざる。"
            },
            {
              "name": "組み合わせを潰す",
              "kind": "実例",
              "summary": "a.b が必要なのに a まで圧縮する。分ける必要がある境界を無視することになり、出来上がったものに違和感が出る。症状は、一つの操作があらゆる能力を持ちすぎることである。"
            }
          ]
        },
        {
          "name": "仕様が持つ特徴と、規約が持つ特徴",
          "kind": "分類",
          "summary": "仕様が定めるのは類までであり、個体を定めるのは規約である。犬という類は特徴の束から定まるが、柴犬か秋田犬かは犬種の側が持つ。",
          "children": [
            {
              "name": "仕様が持つもの",
              "kind": "定義",
              "summary": "具体を断定できる、意味を持つ特徴。利用者にとって何が成り立つかとして書く。"
            },
            {
              "name": "規約が持つもの",
              "kind": "定義",
              "summary": "犬種にあたる特徴。クラス名の付け方、実装する単位と場所、命名規則、依存の向き、テストの置き方。言語やアーキテクチャによって変わるもの。"
            },
            {
              "name": "仕様に具体を書くと腐る",
              "kind": "判断基準",
              "summary": "具体の表現の仕方が変わったとき、業務が変わっていないのに仕様が書き換わる。書き換わった仕様は、どこが古いのかを判別できなくなり、文書全体が信用されなくなる。"
            }
          ]
        },
        {
          "name": "仕様と実装をつなぐ契約",
          "kind": "定義",
          "summary": "受け入れ基準と振る舞いのシナリオが、仕様と実装をつなぐ抽象概念である。シナリオを一字一句テストへ転写して実装することで、両者がつながる。集約の不変条件も、同じつなぎ方をする。"
        },
        {
          "name": "特徴が足りないと、具体に現れない",
          "kind": "実例",
          "summary": "仕様に、具体を表現するだけの意味的な特徴が抜けていれば、具体でそれを表現できるわけがない。足りない特徴は、実装の努力では埋まらない。",
          "children": [
            {
              "name": "値オブジェクトの定義漏れ",
              "kind": "実例",
              "summary": "値オブジェクトが仕様で定義されていなければ、どうやってもその表現は実装に現れない。"
            },
            {
              "name": "操作の欠落",
              "kind": "実例",
              "summary": "あるユースケースが A・B・C を伴うのに、意味的な説明から C が抜ければ、具体に C は現れない。"
            }
          ]
        },
        {
          "name": "アンチパターン",
          "kind": "アンチパターン",
          "summary": "この概念に関して繰り返し起きる誤り。",
          "children": [
            {
              "name": "情報を削減して抽象と呼ぶ",
              "kind": "アンチパターン",
              "summary": "短くすること・要素を減らすことを抽象だと思う。図解でも要素の数は変わらないはずで、束ねたいなら分解した要素を区画で囲む表現になる。"
            },
            {
              "name": "正しい高さを、どう作るかで書く",
              "kind": "アンチパターン",
              "summary": "仕組みや手順で高さを説明してしまう。特徴は意味であって仕組みではない。"
            },
            {
              "name": "動物まで上げる",
              "kind": "アンチパターン",
              "summary": "一段下ろしても具体が定まらない高さまで上げ、抽象化できたと考える。"
            },
            {
              "name": "仕様に実装の綴りを書く",
              "kind": "アンチパターン",
              "summary": "クラス名や置き場所を仕様が持つ。犬の定義に犬種を書くのと同じで、言語を変えると仕様が書き換わる。"
            }
          ]
        }
      ]
    },
    "provenance": {
      "blockType": "Provenance",
      "title": "出典・根拠の透明性",
      "source": "外部の文献ではなく、Waffle の作り手との対話で定式化したもの。犬を動物へ抽象化する例と、機械学習の次元圧縮の比喩を通じて言語化された。段のベースには ドメイン駆動設計 の確立された抽象概念（事業領域・業務領域・区切られた文脈・集約・値オブジェクト・エンティティ・業務ユースケース・業務サービス）を置き、その上に Waffle 独自の判断を重ねている。",
      "caveats": "次元圧縮の比喩は、圧縮してよい限度の測り方までは正確に当てはまるが、落とし方は異なる。主成分分析が作る軸は元の軸の線形結合であって、人が読める名前を持たない。一方、仕様が持つ特徴は読める意味を持たねばならない。したがってここで行うのは軸の合成ではなく、意味を保った特徴の選択である。"
    },
    "relatedConcepts": {
      "blockType": "RelatedConcepts",
      "title": "関連概念",
      "items": [
        {
          "conceptId": "subdomain",
          "note": "抽象の段の上限にあたる、事業活動の分け方"
        },
        {
          "conceptId": "bounded-context",
          "note": "モデルの側の段の起点。業務領域とは包含ではなく対応の関係にある"
        },
        {
          "conceptId": "ubiquitous-language",
          "note": "特徴を書くときに使える言葉の範囲を定める"
        },
        {
          "conceptId": "domain-model",
          "note": "段の下側にあたる、集約・値オブジェクト・エンティティの置き方"
        }
      ],
      "emptyReason": ""
    }
  },
  "tags": [
    "topic:abstraction",
    "topic:spec-implementation-boundary"
  ],
  "knowledgeKind": "process"
}
