{
  "documentId": "probe-x",
  "documentType": "Knowledge",
  "schemaRef": "KnowledgeSchema/v6",
  "status": "DRAFT",
  "content": {
    "title": {
      "blockType": "Title",
      "title": ""
    },
    "description": {
      "blockType": "Overview",
      "title": "概要",
      "questions": [],
      "text": ""
    },
    "nodes": {
      "blockType": "Nodes",
      "title": "",
      "items": []
    },
    "provenance": {
      "blockType": "Provenance",
      "title": "出典・根拠の透明性",
      "source": "",
      "caveats": ""
    },
    "relatedConcepts": {
      "blockType": "RelatedConcepts",
      "title": "関連概念",
      "items": [],
      "emptyReason": ""
    }
  },
  "tags": []
}
