{
  "documentId": "knowledge-cand-concept-property-algorithm-is-the-spec-boundary",
  "documentType": "Knowledge",
  "schemaRef": "KnowledgeSchema/v6",
  "status": "DRAFT",
  "content": {
    "title": {
      "blockType": "Title",
      "title": "設計の記述は概念・満たすべき性質・そのためのアルゴリズムの3層を持ち、欠けるのは真ん中である：knowledge-cand-concept-property-algorithm-is-the-spec-boundary"
    },
    "description": {
      "blockType": "Overview",
      "title": "概要",
      "questions": [
        "実装の説明を書くとき、何を書けば足りたことになるか",
        "アルゴリズムの説明はあるのに読み手が納得しないのは、何が欠けているからか",
        "書いた性質が守られているかを、どうやって担保するか",
        "破りが多く見つかったとき、実装と性質のどちらを直すか",
        "測るために作った道具を、そのまま製品として置いてよいか"
      ],
      "text": "設計の記述は、概念（何のためか）・満たすべき性質（何が成り立てばその概念が成立するか）・そのためのアルゴリズム（性質を保証する手）という、上から下へ導出される3層を持つ。実装を全数で当てると、欠けるのは常に真ん中の性質であり、書かれていても測られていなければ守られない。"
    },
    "nodes": {
      "blockType": "Nodes",
      "title": "3層と、その欠け方",
      "items": [
        {
          "name": "3つの層",
          "kind": "定義",
          "sourceRef": "docs/adr/three-layer-audit.html 節00（頭の図）",
          "summary": "設計の記述は3つの層を持つ。概念（それが何のためのものか）、満たすべき性質（何が成り立てばその概念が成立するか）、そのためのアルゴリズム（性質を構造として保証する手）。3つは対等な並びではなく、上から下へ導出される鎖である。",
          "children": [
            {
              "name": "概念だけでは実装は導けない",
              "kind": "判断基準",
              "sourceRef": "同 節00",
              "summary": "概念から直接アルゴリズムへ飛ぶと、そのアルゴリズムでなければならない理由が出ない。間に性質が立って初めて、選んだ手が唯一である（あるいは唯一でない）と言える。"
            },
            {
              "name": "性質はアルゴリズムを一意に決めるまで書く",
              "kind": "判断基準",
              "sourceRef": "同 節02",
              "summary": "性質の書き方の下限は、それを読んだ人が具体を組み立てたときに2通り以上に成り立たないこと。実際に3層がそろっている記述は「〜するしかない」という形で終わっている。"
            }
          ]
        },
        {
          "name": "欠けるのは常に真ん中",
          "kind": "実例",
          "sourceRef": "docs/adr/three-layer-audit.html 節01（24モジュール4,610行の全数調査）",
          "summary": "1つの実装（描画エンジン、24モジュール4,610行）を全数で当てたところ、アルゴリズムは全モジュールにあり、概念もほぼ全てにあった。欠けていたのは真ん中の性質だけで、12が3層そろい、8が性質を欠き、2は位置づけが試験のまま製品に混ざっていた。",
          "children": [
            {
              "name": "判断が集まる場所ほど性質が薄い",
              "kind": "アンチパターン",
              "sourceRef": "同 節04",
              "summary": "最大のモジュール（469行、接続点・迂回・描く順序といった判断が最も集まる場所）に、性質が1つも書かれていなかった。理由は行コメントに散っており、読む側は全行を読み切るまでその核が何を守っているのかを知れない状態だった。"
            }
          ]
        },
        {
          "name": "検査されない性質は、性質ではない",
          "kind": "判断基準",
          "sourceRef": "docs/adr/three-layer-audit.html 節04",
          "summary": "性質が書かれていても、それを測る手立てが無ければ守られない。実例：型の説明に「囲む最小の大きさ」と書かれていたが誰も測っておらず、実測すると23部品中9部品が破っていた（最も緩いものは中身が申告の32%）。書くことと拾えるようにすることは、同じ1つの作業の両面である。",
          "children": [
            {
              "name": "守れないなら性質の側を下げる",
              "kind": "判断基準",
              "sourceRef": "同 節06",
              "summary": "破りが多いとき、実装を全部直すのではなく、性質が過剰でないかを先に問う。上の例では「最小である」を降ろし「含む」だけを課した ── 余白を持つのが正しい種類の部品があったため。降ろした結果は全部品を通す検査になり、以後は破れば落ちる。"
            },
            {
              "name": "性質の書き方が狭いと、アルゴリズムも狭くなる",
              "kind": "実例",
              "sourceRef": "同 節06",
              "summary": "「札どうしが重ならない」とだけ書いていたため、実装も札どうししか見ておらず、節点の名前と重なった。さらに、避ける相手へ節点を加えても直らなかった ── 逃げ場そのものが足りていなかった。性質を「逃げ場がある」まで広げて初めて、間隔を導く実装になった。"
            }
          ]
        },
        {
          "name": "横から入るもの、後ろで閉じるもの",
          "kind": "関連",
          "sourceRef": "docs/adr/three-layer-audit.html 節06、および adr-convention-is-not-a-layer",
          "summary": "3層の鎖の外に、2つの要素が付く。規約（層ではなく、実装を導くもう一つの入力。描画エンジンではトークン体系がこれに当たる）と、受け入れ基準（性質が守られているかを閉じるもの）。この2つを含めると、この3層は仕様と実装の抽象境界そのものと同じ形になる。",
          "children": [
            {
              "name": "違うのは機械の結びつきの有無だけ",
              "kind": "対比",
              "sourceRef": "同 節06",
              "summary": "仕様として文書に置いた場合は、宣言と実装のドリフトを検査が突き合わせる。コードの説明文として置いた場合は、性質が書かれていなくても、破られても、何も落ちない。同じ形をしていても、拾う仕組みの有無で効き方が変わる。"
            }
          ]
        },
        {
          "name": "測るために作ったものを、黙って製品にしない",
          "kind": "アンチパターン",
          "sourceRef": "docs/adr/three-layer-audit.html 節05",
          "summary": "「足せることを測るために作った」と自ら書いた部品が2つ、そのまま索引にも比較表にも製品として並んでいた。製品として何を保証するかを一度も書いていない。測り終えた道具を昇格させるなら、その時に3層を書く ── 書けないなら、置き場所は例の側である。"
        }
      ]
    },
    "provenance": {
      "blockType": "Provenance",
      "title": "出典・根拠の透明性",
      "source": "確立された文献に基づくものではない。このリポジトリ自身の決定（囲みの位置づけの整理）で使った枠組みを、同じリポジトリの描画エンジン24モジュール4,610行へ全数で当てた結果として得た。数値はすべてそのときの実測。したがって advisor のバックボーンには配らず、この Orchestrator 自身の方法論として置く。",
      "caveats": "対象が1つの実装だけで、他の実装で同じ偏り（欠けるのが常に真ん中）が出るかは確かめていない。また『性質はアルゴリズムを一意に決めるまで書く』の下限は、仕様の下限として既に決定済みの規則を当てはめたものであり、コードの説明文に対しても同じ下限でよいかは検証していない。"
    },
    "relatedConcepts": {
      "blockType": "RelatedConcepts",
      "title": "関連概念",
      "items": [
        {
          "conceptId": "asset-authoring-contract-for-component-svg-engines",
          "note": "この3層を当てた対象そのものの契約。今回の修正で内容が実装とずれた"
        },
        {
          "conceptId": "self-improving-generation-cycle",
          "note": "性質を検査で拾えるようにすることが、このサイクルの測る段に当たる"
        },
        {
          "conceptId": "architecture-evidence-based-scope",
          "note": "性質を書けない段階で無理に決めないための、抽象化のタイミングの基準"
        }
      ],
      "emptyReason": ""
    }
  },
  "tags": [
    "topic:design-description",
    "topic:spec-implementation-boundary"
  ],
  "knowledgeKind": "process",
  "agentRefs": [
    "waffle"
  ],
  "skillRefs": []
}
