{
  "documentId": "knowledge-cand-aggregate-declaration-is-not-class-existence",
  "documentType": "Knowledge",
  "schemaRef": "KnowledgeSchema/v6",
  "status": "ACTIVE",
  "content": {
    "title": {
      "blockType": "Title",
      "title": "集約の宣言と、実装に現れる形：knowledge-cand-aggregate-declaration-is-not-class-existence"
    },
    "provenance": {
      "blockType": "Provenance",
      "title": "出典・根拠の透明性",
      "source": "ddd-advisor と tech-lead-advisor へ同一の論点を並列で諮った際に、両者の見解が割れた事例（2026-08-01）。tech-lead-advisorは「集約を宣言しておいて別文書で打ち消しているなら、検査が矛盾を報告するのは正しい動作であり、宣言側を直すべき」とし、ddd-advisorは「集約の定義にクラスは含まれず、補完領域ではトランザクション境界として現れる。検査側を直すべき」とした。Evans/Vernonの集約の定義と、Fowlerの業務ロジックの実装方法の4分類に依拠した再構成であり、直接引用ではない。2026-08-17、domain-model（『ドメイン駆動設計をはじめよう』第6章の書き起こし）と突き合わせて3点を訂正した ── (1)「クラスであることは定義に含まれない」を「階層を1つのクラスへ閉じ込めることは定義に含まれない」へ改めた。書き起こしは集約をエンティティの階層構造と定義しており、階層を持つことは定義に含まれる。(2) 実装方法ごとの現れ方の3つ目を「トランザクション境界として現れる」から「集約という部品が現れない」へ改めた。トランザクションスクリプトの領域に集約という部品は無く、同じ名前で別の形を指していた。(3) 書き起こしが定める「境界の内側は実体で持ち、外は識別子で指す」「エンティティは単独で実装しない」を原則として追加した。関連概念の注記がこの原則の出どころとしてdomain-modelを挙げていながら、本文で一度も使っていなかった。",
      "caveats": "「トランザクション境界に収まっているか」を静的解析だけで判定できる範囲は限られる。判定できない部分は検査の対象外であることを明示し、赤にしないのが正しい振る舞いだが、その境界線をどこに引くかは未確定。またこの整理は、実装方法が文書に宣言されていることを前提にしている。宣言が無い状態では、分類から推測するしかなく、その推測は上記のとおり取りこぼす。加えて「厚いモデルを組まない領域でも集約の境界は残る」という整理は、書き起こしの帰結ではなくこの製品の側での外挿である。書き起こしは、ドメインモデルを中核の業務領域に使い、補完・一般には別の実装方法を使うとまでしか述べていない。"
    },
    "relatedConcepts": {
      "blockType": "RelatedConcepts",
      "title": "関連概念",
      "items": [
        {
          "conceptId": "business-logic-simple",
          "note": "薄い手続きで実装してよい条件と、その場合に唯一守るべき規律（トランザクション管理）を定める"
        },
        {
          "conceptId": "domain-model",
          "note": "集約・エンティティ・値オブジェクトの定義そのもの。この文書の記述が食い違ったときは、こちらが正となる"
        },
        {
          "conceptId": "design-heuristics",
          "note": "分類→実装方法→技術方式→テスト方針という連鎖。中間項を飛ばしてはならない根拠"
        },
        {
          "conceptId": "subdomain",
          "note": "中核／一般／補完の分類そのものと、分類が決めるもの・決めないものの境界"
        }
      ],
      "emptyReason": ""
    },
    "description": {
      "blockType": "Overview",
      "title": "概要",
      "questions": [
        "specが集約を宣言したとき、実装に集約ルートのクラスが存在しなければならないか",
        "集約は、境界の内側のエンティティや値オブジェクトを実体で持つのか、識別子で参照するのか",
        "補完サブドメインで厚いドメインモデルを組まないとき、宣言した不変条件は何が守るのか",
        "サブドメイン分類を、検査の適用条件として直接使ってよいか",
        "宣言と実装の対応を機械的に確かめるとき、何を対象にすべきか"
      ],
      "text": "集約は、エンティティと値オブジェクトの階層構造であり、一貫性の境界である。境界の内側は実体で持ち、境界の外の集約は識別子で指す。定義に含まれないのは、その階層を1つのクラスへ閉じ込めることであり、クラス化は複雑さを減らす手段として、複雑さが無い領域では空振りする。厚いモデルを組まない領域では、集約という部品が実装に現れず、トランザクション境界だけが残る。"
    },
    "nodes": {
      "blockType": "Nodes",
      "title": "集約の宣言と、実装に現れる形",
      "items": [
        {
          "name": "集約とは",
          "kind": "定義",
          "sourceRef": "domain-model 6.2.2.3（『ドメイン駆動設計をはじめよう』第6章の書き起こし）",
          "summary": "集約は、エンティティと値オブジェクトの階層構造であり、1つのトランザクションで変更される一貫性の境界である。階層を持つことと境界であることは、どちらも定義に含まれる。定義に含まれないのは、その階層を1つのクラスへ閉じ込めることである。クラス化は不変条件をカプセル化するための手段であって、集約であることの条件ではない。",
          "children": [
            {
              "name": "境界の内側は実体で持ち、外は識別子で指す",
              "kind": "判断基準",
              "sourceRef": "domain-model 図6-4",
              "summary": "集約は境界の内側のエンティティと値オブジェクトを実体で持ち、境界の外の集約は識別子で参照する。識別子で指すことが「これは境界の外側だ」という表明になる。内側まで識別子で切ると内と外の区別が消え、1つのトランザクションで変わる範囲が決まらなくなる。"
            },
            {
              "name": "外部が触れるのはルートだけ",
              "kind": "判断基準",
              "sourceRef": "domain-model 図6-5",
              "summary": "外部に公開するインターフェース役のエンティティは1つにする。内部の他のエンティティの状態を変えるコマンドも、必ずルートを経由して実行する。状態を変える経路がルートの公開メソッドだけに閉じていることが、不変条件を各コマンドへ分配できる前提になる。"
            },
            {
              "name": "エンティティは単独で実装しない",
              "kind": "判断基準",
              "sourceRef": "domain-model 6.2.2.2",
              "summary": "エンティティは単独で実装せず、必ずどれかの集約の実装の一部になる。仕様の側で集約とエンティティを別々の文書に分けて書く場合も、どの集約の境界の内側かが分かる形でなければ、この規律を確かめられない。"
            }
          ]
        },
        {
          "name": "クラスへ閉じ込めることが有効な条件",
          "kind": "判断基準",
          "sourceRef": "business-logic-simple",
          "summary": "クラス化が有効なのは、カプセル化すべき複雑さがあるときに限られる。状態遷移も業務ルールの絡み合いも無い領域で1つのクラスを要求すると、不必要な階層を増やすだけになる。"
        },
        {
          "name": "業務ロジックの実装方法ごとの現れ方",
          "kind": "分類",
          "sourceRef": "business-logic-simple / design-heuristics",
          "summary": "サブドメイン分類は実装形を直接決めない。分類と実装形の間には「業務ロジックの実装方法」という中間項があり、実装方法ごとに、宣言した集約が実装のどこに現れるかが変わる。",
          "children": [
            {
              "name": "クラスとして現れる",
              "kind": "定義",
              "summary": "ドメインモデル／イベント履歴式。集約ルートがエンティティのクラスとして実装され、状態変更経路が自分のメソッドに絞られる。"
            },
            {
              "name": "データ構造のクラスとして現れる",
              "kind": "定義",
              "summary": "アクティブレコード。データ構造はカプセル化されるが、不変条件のカプセル化までは要求されない。"
            },
            {
              "name": "集約という部品が現れない",
              "kind": "定義",
              "summary": "トランザクションスクリプト。集約という部品そのものが実装に現れない。残るのは、一連の更新が全成功か全失敗かで終わるというトランザクション境界だけで、宣言した集約はその境界として読む。名前は同じでも、エンティティの階層を持つ集約とは別の形であることに注意する。"
            }
          ]
        },
        {
          "name": "宣言と実装の食い違いを、どこで判定するか",
          "kind": "判断基準",
          "summary": "「集約を宣言したのにクラスが無い」ことは、それ自体では欠陥ではない。実装方法が薄い手続きだと宣言されている場合、クラスが無いのは仕様どおりである。欠陥は「宣言した不変条件を、クラスもトランザクション境界も守っていない」ときに生じる。判定は、分類ではなく宣言された実装方法に対して行う。"
        },
        {
          "name": "分類を検査の分岐条件へ転用しない",
          "kind": "判断基準",
          "sourceRef": "design-heuristics",
          "summary": "サブドメイン分類は設計時の判断基準であり、検査の分岐条件へ転用すると、分類を1語書き換えるだけで検査が静かに無効化される。転用するなら中間項（業務ロジックの実装方法）を経由する。補完でもデータ構造が複雑ならアクティブレコード＝クラスが現れるため、中間項を飛ばすと取りこぼす。"
        },
        {
          "name": "文書を共有し、コメントを受け取る仕組み",
          "kind": "実例",
          "summary": "この業務領域は補完に分類され、設計ガイドには「厚いドメインモデルを組まず、薄い手続きとして実装する。守るべき規則は集約の不変条件として書き留めるが、そのために階層を増やさない」と書かれている。specは共有アーティファクトという集約を宣言し、不変条件として「閲覧トークンを新しく発行したとき、それまでの閲覧トークンは常に使えなくなる」を持つ。実装には集約ルートのクラスが無く、関数が保管から読んだ値を加工する。ここで「クラスが無いから実装が仕様に追いついていない」と判定するのは誤りである。設計ガイドがクラスを組まないよう指示しており、実装はそれに従っている。本当の欠陥は別のところにあった。公開の手続きが、中身を1つの保管へ、閲覧トークンを別の保管へ、それぞれ書き込んでいた。宣言された不変条件は両方が揃うことに依存しており、片方だけ成功すると破れる。クラスの不在を咎める検査はこれを見逃し、要求すべきでないクラスの不在で赤を出していた。同時に厳しすぎて緩すぎる状態である。"
        },
        {
          "name": "集約の宣言をクラスの存在と同一視する",
          "kind": "アンチパターン",
          "summary": "厚いモデルを組まないと決めた領域で、仕様どおりの実装が恒常的に違反として報告される。報告が常に赤いため、本物の違反が埋もれる。"
        },
        {
          "name": "境界の内側まで識別子で切る",
          "kind": "アンチパターン",
          "summary": "集約が内側のエンティティや値オブジェクトを実体で持たず、すべてを識別子で参照する形にすると、境界の内と外が同じ書き方になる。どこまでが1つのトランザクションで変わるのかが読めなくなり、集約が一貫性の境界であることが名前だけになる。識別子で指してよいのは、境界の外の集約である。"
        },
        {
          "name": "どの集約にも属さないエンティティを書く",
          "kind": "アンチパターン",
          "summary": "エンティティは必ずどれかの集約の実装の一部になる。属さないまま書くと、そのエンティティの一貫性を誰が守るかが決まらず、宣言した不変条件の担保先が無くなる。仕様の側で単位を分けて書くときは、どの集約の境界の内側かが判定できる形にする。"
        },
        {
          "name": "サブドメイン分類から実装形へ直接跳ぶ",
          "kind": "アンチパターン",
          "summary": "中間項（業務ロジックの実装方法）を飛ばすため、補完でもクラスが現れる場合（アクティブレコード）を取りこぼす。分類を1語書き換えるだけで検査が無効化される危険もある。"
        },
        {
          "name": "クラスが無いことを理由に集約の宣言を消す",
          "kind": "アンチパターン",
          "summary": "宣言ごと不変条件が失われる。不変条件は、実装が本当に境界を守っているかを判定する唯一の根拠であり、消すと本物の欠陥が欠陥でなくなる。"
        },
        {
          "name": "厚いモデルを組まない選択と、トランザクション管理の放棄を混同する",
          "kind": "アンチパターン",
          "summary": "薄い手続きで実装してよいことと、複数の保管への書き込みを原子性なく行ってよいことは別である。唯一残された規律まで捨てると、宣言した不変条件を誰も守らなくなる。"
        }
      ]
    }
  },
  "tags": [
    "framework:ddd",
    "topic:aggregate",
    "topic:drift-detection"
  ],
  "knowledgeKind": "domain",
  "agentRefs": [
    "waffle"
  ],
  "skillRefs": [
    "ddd-advisor",
    "tech-lead-advisor"
  ]
}
